{
  "$schema": "https://raw.githubusercontent.com/comatory/tyden-agenda/main/internal/agenda/schema/agenda.schema.json",
  "title": "Rodinny rozvrh",
  "week": "2026-W38",
  "timezone": "Europe/Prague",
  "days": ["mon", "tue", "wed", "thu", "fri"],
  "timeRange": {
    "start": "07:00",
    "end": "19:00"
  },
  "people": [
    { "id": "ema", "label": "Ema" },
    { "id": "max", "label": "Max" }
  ],
  "slots": [
    { "label": "0", "start": "07:00", "end": "07:45" },
    { "label": "1", "start": "08:00", "end": "08:45" },
    { "label": "2", "start": "08:55", "end": "09:40" },
    { "label": "3", "start": "10:00", "end": "10:45" },
    { "label": "4", "start": "10:55", "end": "11:40" },
    { "label": "5", "start": "11:50", "end": "12:35" }
  ],
  "events": [
    { "person": "ema", "day": "mon", "start": "08:00", "end": "08:45", "title": "Cj", "subtitle": "Novakova", "note": "2.A" },
    { "person": "ema", "day": "mon", "start": "08:55", "end": "09:40", "title": "M", "subtitle": "Svoboda", "note": "2.A" },
    { "person": "ema", "day": "mon", "start": "10:00", "end": "10:45", "title": "Aj", "subtitle": "Green", "note": "A2" },
    { "person": "ema", "day": "mon", "start": "10:55", "end": "11:40", "title": "Hv", "subtitle": "Dvorak", "note": "2.A" },
    { "person": "ema", "day": "mon", "start": "12:00", "end": "15:00", "title": "Druzina", "style": "muted" },
    { "person": "ema", "day": "mon", "start": "16:00", "end": "17:30", "title": "Keramika", "subtitle": "Atelier", "note": "Dilna 3", "style": "outline" },
    { "person": "max", "day": "mon", "start": "07:45", "end": "15:00", "title": "Skolka", "style": "muted" },
    { "person": "max", "day": "mon", "start": "17:15", "end": "18:00", "title": "Plavani", "subtitle": "Mestsky bazen", "style": "outline" },
    { "person": "ema", "day": "tue", "start": "08:00", "end": "08:45", "title": "Tv", "subtitle": "Pokorny", "note": "Telocvicna" },
    { "person": "ema", "day": "tue", "start": "08:55", "end": "09:40", "title": "Tv", "subtitle": "Pokorny", "note": "Telocvicna" },
    { "person": "ema", "day": "tue", "start": "10:00", "end": "10:45", "title": "Cj", "subtitle": "Novakova", "note": "2.A" },
    { "person": "ema", "day": "tue", "start": "10:55", "end": "11:40", "title": "M", "subtitle": "Svoboda", "note": "2.A" },
    { "person": "ema", "day": "tue", "start": "11:50", "end": "12:35", "title": "Prv", "subtitle": "Novakova", "note": "2.A" },
    { "person": "ema", "day": "tue", "start": "12:45", "end": "15:00", "title": "Druzina", "style": "muted" },
    { "person": "max", "day": "tue", "start": "07:45", "end": "15:00", "title": "Skolka", "style": "muted" },
    { "person": "max", "day": "tue", "start": "16:30", "end": "17:15", "title": "Hudebka", "subtitle": "Klubovna", "style": "outline" },
    { "person": "ema", "day": "wed", "start": "08:00", "end": "08:45", "title": "Cj", "subtitle": "Novakova", "note": "2.A" },
    { "person": "ema", "day": "wed", "start": "08:55", "end": "09:40", "title": "Aj", "subtitle": "Green", "note": "A1" },
    { "person": "ema", "day": "wed", "start": "08:55", "end": "09:40", "title": "Aj", "subtitle": "Brown", "note": "A2", "style": "outline" },
    { "person": "ema", "day": "wed", "start": "10:00", "end": "10:45", "title": "Prv", "subtitle": "Novakova", "note": "2.A" },
    { "person": "ema", "day": "wed", "start": "10:55", "end": "11:40", "title": "Cj", "subtitle": "Novakova", "note": "2.A" },
    { "person": "ema", "day": "wed", "start": "12:00", "end": "15:00", "title": "Druzina", "style": "muted" },
    { "person": "max", "day": "wed", "start": "07:45", "end": "15:00", "title": "Skolka", "style": "muted" },
    { "person": "ema", "day": "thu", "start": "08:00", "end": "08:45", "title": "Cj", "subtitle": "Novakova", "note": "2.A" },
    { "person": "ema", "day": "thu", "start": "08:55", "end": "09:40", "title": "M", "subtitle": "Svoboda", "note": "2.A" },
    { "person": "ema", "day": "thu", "start": "10:00", "end": "10:45", "title": "Aj", "subtitle": "Green", "note": "A1" },
    { "person": "ema", "day": "thu", "start": "10:00", "end": "10:45", "title": "Aj", "subtitle": "Brown", "note": "A2", "style": "outline" },
    { "person": "ema", "day": "thu", "start": "10:55", "end": "11:40", "title": "Vv", "subtitle": "Dvorak", "note": "Atelier" },
    { "person": "ema", "day": "thu", "start": "12:00", "end": "15:00", "title": "Druzina", "style": "muted" },
    { "person": "ema", "day": "thu", "start": "17:30", "end": "18:15", "title": "Anglictina", "subtitle": "Jazykove centrum", "note": "A-12", "style": "outline" },
    { "person": "max", "day": "thu", "start": "07:45", "end": "15:00", "title": "Skolka", "style": "muted" },
    { "person": "max", "day": "thu", "start": "16:35", "end": "17:20", "title": "Anglictina", "subtitle": "Jazykove centrum", "note": "B-04", "style": "outline" },
    { "person": "ema", "day": "fri", "start": "08:00", "end": "08:45", "title": "M", "subtitle": "Svoboda", "note": "2.A" },
    { "person": "ema", "day": "fri", "start": "08:55", "end": "09:40", "title": "Cj", "subtitle": "Novakova", "note": "2.A" },
    { "person": "ema", "day": "fri", "start": "10:00", "end": "10:45", "title": "Pc", "subtitle": "Dvorak", "note": "Dilna" },
    { "person": "ema", "day": "fri", "start": "10:55", "end": "11:40", "title": "Vv", "subtitle": "Dvorak", "note": "Atelier" },
    { "person": "ema", "day": "fri", "start": "12:00", "end": "15:00", "title": "Druzina", "style": "muted" },
    { "person": "max", "day": "fri", "start": "07:45", "end": "15:00", "title": "Skolka", "style": "muted" },
    { "person": "max", "day": "fri", "start": "15:30", "end": "17:00", "title": "Florbal", "subtitle": "Sportovni hala", "style": "outline" }
  ]
}
